{
  "schemaVersion": 2,
  "profileId": "valid_pass_not_evaluated",
  "toolchainProfileId": "orion_toolchain_2026_09_03_01",
  "recordedAt": "2026-09-03T12:00:00Z",
  "environment": { "kind": "CONTAINER", "androidRuntimeEvidence": "NON_DEFINITIVE" },
  "device": { "manufacturer": "Samsung", "model": "Galaxy S21", "soc": "Exynos 2100", "ramMiB": 8192, "androidBuild": "test", "apiLevel": 31 },
  "app": { "buildId": "test", "commitSha": "0000000000000000000000000000000000000000", "buildVariant": "benchmark" },
  "workload": { "kind": "LLM", "candidate": "test", "artifactSha256": "0000000000000000000000000000000000000000000000000000000000000000", "quantization": "Q4", "inferenceBackend": "CPU", "threads": 2, "contextTokens": 2048, "generatedTokens": 128 },
  "measurements": { "commandDurationMs": 1, "loadTimeMs": 1, "firstTokenLatencyMs": 1, "tokensPerSecond": 1, "rssBaselineKiB": 1, "peakRssKiB": 1, "rssAfterUnloadKiB": 1, "batteryStartPercent": 90, "batteryEndPercent": 89, "initialTemperatureC": 30, "thermalStatus": "NONE" },
  "termination": { "exitReason": "NORMAL", "executionResult": "PASS", "qualificationResult": "NOT_EVALUATED", "qualificationCriteriaId": null }
}
